{
    "definitionUrl": "https://acf.hhs.gov/formspec/csbg/tribal-short",
    "definitionVersion": "3.0.0",
    "status": "in-progress",
    "authored": "2026-03-04T12:00:00Z",
    "data": {
        "basicInfo": {},
        "expenditures": {
            "applicableTopics": [],
            "employment": null,
            "childcare": null,
            "assetBuilding": null,
            "housing": null,
            "health": null,
            "civic": null,
            "transportation": null,
            "partnerships": null,
            "other": null,
            "total": {
                "amount": "0.00",
                "currency": "USD"
            },
            "hasAdministrationCosts": null,
            "administrationExpenditure": null
        },
        "descriptions": {
            "employmentDesc": null,
            "educationDesc": null,
            "incomeDesc": null,
            "housingDesc": null,
            "healthDesc": null,
            "civicDesc": null,
            "transportationDesc": null,
            "partnershipsDesc": null,
            "otherDesc": null
        }
    }
}
